{
  "$schema": "https://json-schema.org/draft/2020-12/schema",
  "$id": "https://evidentloop.github.io/evidentloop/schemas/audit-v0.5.schema.json",
  "title": "EvidentLoop code-diff audit profile",
  "type": "object",
  "additionalProperties": false,
  "required": [
    "schema_version",
    "graph_id",
    "source",
    "runs",
    "nodes",
    "edges",
    "summary"
  ],
  "properties": {
    "schema_version": {
      "const": "0.5"
    },
    "graph_id": {
      "$ref": "#/$defs/identifier"
    },
    "source": {
      "$ref": "#/$defs/source"
    },
    "runs": {
      "type": "array",
      "minItems": 1,
      "items": {
        "$ref": "#/$defs/run"
      }
    },
    "nodes": {
      "type": "array",
      "items": {
        "$ref": "#/$defs/node"
      }
    },
    "edges": {
      "type": "array",
      "items": {
        "$ref": "#/$defs/edge"
      }
    },
    "summary": {
      "$ref": "#/$defs/summary"
    },
    "extensions": {
      "$ref": "#/$defs/extensions"
    }
  },
  "$defs": {
    "identifier": {
      "type": "string",
      "minLength": 1,
      "pattern": "^[^\\s]+$"
    },
    "sha256": {
      "type": "string",
      "pattern": "^sha256:[0-9a-f]{64}$"
    },
    "extensions": {
      "type": "object",
      "propertyNames": {
        "pattern": "^[a-z][a-z0-9_]*(?:[.-][a-z0-9_-]+)*$"
      },
      "additionalProperties": true
    },
    "source": {
      "type": "object",
      "additionalProperties": false,
      "required": [
        "type",
        "ref"
      ],
      "properties": {
        "type": {
          "const": "git_diff"
        },
        "ref": {
          "type": "string",
          "minLength": 1
        },
        "description": {
          "type": "string"
        },
        "extensions": {
          "$ref": "#/$defs/extensions"
        }
      }
    },
    "claim": {
      "type": "object",
      "additionalProperties": false,
      "required": [
        "id",
        "text",
        "status",
        "reason"
      ],
      "properties": {
        "id": {
          "$ref": "#/$defs/identifier"
        },
        "text": {
          "type": "string",
          "minLength": 1
        },
        "status": {
          "enum": [
            "supported",
            "challenged",
            "partial",
            "unknown"
          ]
        },
        "reason": {
          "type": "string",
          "minLength": 1
        },
        "extensions": {
          "$ref": "#/$defs/extensions"
        }
      }
    },
    "summaryAudit": {
      "type": "object",
      "additionalProperties": false,
      "required": [
        "status",
        "claims"
      ],
      "properties": {
        "status": {
          "enum": [
            "supported",
            "challenged",
            "partial",
            "unknown",
            "not_audited"
          ]
        },
        "claims": {
          "type": "array",
          "items": {
            "$ref": "#/$defs/claim"
          }
        },
        "extensions": {
          "$ref": "#/$defs/extensions"
        }
      }
    },
    "feedbackEvent": {
      "type": "object",
      "additionalProperties": false,
      "required": [
        "target_type",
        "target_id",
        "action",
        "fingerprint",
        "graph_id",
        "run_id",
        "created_at",
        "source_audit_sha256"
      ],
      "properties": {
        "target_type": {
          "const": "finding"
        },
        "target_id": {
          "$ref": "#/$defs/identifier"
        },
        "action": {
          "enum": [
            "accept",
            "false_positive",
            "comment",
            "severity_override"
          ]
        },
        "fingerprint": {
          "$ref": "#/$defs/sha256"
        },
        "graph_id": {
          "$ref": "#/$defs/identifier"
        },
        "run_id": {
          "$ref": "#/$defs/identifier"
        },
        "created_at": {
          "type": "string",
          "format": "date-time"
        },
        "source_audit_sha256": {
          "$ref": "#/$defs/sha256"
        },
        "comment": {
          "type": [
            "string",
            "null"
          ],
          "maxLength": 4000
        },
        "severity": {
          "type": [
            "string",
            "null"
          ],
          "enum": [
            "high",
            "medium",
            "low",
            "note",
            null
          ]
        }
      },
      "allOf": [
        {
          "if": {
            "properties": {
              "action": {
                "const": "comment"
              }
            }
          },
          "then": {
            "required": [
              "comment"
            ],
            "not": {
              "required": [
                "severity"
              ]
            }
          }
        },
        {
          "if": {
            "properties": {
              "action": {
                "const": "severity_override"
              }
            }
          },
          "then": {
            "required": [
              "severity"
            ],
            "not": {
              "required": [
                "comment"
              ]
            }
          }
        },
        {
          "if": {
            "properties": {
              "action": {
                "enum": [
                  "accept",
                  "false_positive"
                ]
              }
            }
          },
          "then": {
            "not": {
              "anyOf": [
                {
                  "required": [
                    "comment"
                  ]
                },
                {
                  "required": [
                    "severity"
                  ]
                }
              ]
            }
          }
        }
      ]
    },
    "revision": {
      "type": "object",
      "additionalProperties": false,
      "required": [
        "source_run_id",
        "source_audit_sha256",
        "feedback_sha256",
        "source_summary",
        "events",
        "notice"
      ],
      "properties": {
        "source_run_id": {
          "$ref": "#/$defs/identifier"
        },
        "source_audit_sha256": {
          "$ref": "#/$defs/sha256"
        },
        "feedback_sha256": {
          "$ref": "#/$defs/sha256"
        },
        "source_summary": {
          "$ref": "#/$defs/summarySnapshot"
        },
        "events": {
          "type": "array",
          "minItems": 1,
          "items": {
            "$ref": "#/$defs/feedbackEvent"
          }
        },
        "notice": {
          "const": "报告已按人工裁定更新；未重新审查代码，模型原判断仍保留。"
        }
      }
    },
    "run": {
      "type": "object",
      "additionalProperties": false,
      "required": [
        "id",
        "label",
        "status",
        "summary",
        "kind"
      ],
      "properties": {
        "id": {
          "$ref": "#/$defs/identifier"
        },
        "label": {
          "type": "string",
          "minLength": 1
        },
        "status": {
          "enum": [
            "pass_candidate",
            "concerns",
            "needs_human_triage",
            "inconclusive"
          ]
        },
        "summary": {
          "type": "string"
        },
        "kind": {
          "enum": [
            "model_review",
            "feedback_revision"
          ]
        },
        "revision": {
          "$ref": "#/$defs/revision"
        },
        "summary_audit": {
          "$ref": "#/$defs/summaryAudit"
        },
        "extensions": {
          "$ref": "#/$defs/extensions"
        }
      },
      "allOf": [
        {
          "if": {
            "properties": {
              "kind": {
                "const": "feedback_revision"
              }
            },
            "required": [
              "kind"
            ]
          },
          "then": {
            "required": [
              "revision"
            ]
          }
        },
        {
          "if": {
            "properties": {
              "kind": {
                "const": "model_review"
              }
            },
            "required": [
              "kind"
            ]
          },
          "then": {
            "not": {
              "required": [
                "revision"
              ]
            }
          }
        }
      ]
    },
    "changeNode": {
      "type": "object",
      "additionalProperties": false,
      "required": [
        "id",
        "type",
        "title",
        "summary"
      ],
      "properties": {
        "id": {
          "$ref": "#/$defs/identifier"
        },
        "type": {
          "const": "change"
        },
        "title": {
          "type": "string",
          "minLength": 1
        },
        "summary": {
          "type": "string"
        },
        "summary_audit": {
          "$ref": "#/$defs/summaryAudit"
        },
        "extensions": {
          "$ref": "#/$defs/extensions"
        }
      }
    },
    "fileNode": {
      "type": "object",
      "additionalProperties": false,
      "required": [
        "id",
        "type",
        "path"
      ],
      "properties": {
        "id": {
          "$ref": "#/$defs/identifier"
        },
        "type": {
          "const": "file"
        },
        "path": {
          "type": "string",
          "minLength": 1
        },
        "role": {
          "type": "string"
        },
        "change_type": {
          "enum": [
            "added",
            "modified",
            "deleted",
            "renamed",
            "binary"
          ]
        },
        "additions": {
          "type": "integer",
          "minimum": 0
        },
        "deletions": {
          "type": "integer",
          "minimum": 0
        },
        "extensions": {
          "$ref": "#/$defs/extensions"
        }
      }
    },
    "modelJudgment": {
      "type": "object",
      "additionalProperties": false,
      "required": [
        "status",
        "severity"
      ],
      "properties": {
        "status": {
          "enum": [
            "open",
            "fixed",
            "dismissed"
          ]
        },
        "severity": {
          "enum": [
            "high",
            "medium",
            "low",
            "note"
          ]
        }
      }
    },
    "humanAdjudication": {
      "type": "object",
      "additionalProperties": false,
      "required": [
        "applied_run_id"
      ],
      "properties": {
        "applied_run_id": {
          "$ref": "#/$defs/identifier"
        },
        "disposition": {
          "enum": [
            "accept",
            "false_positive"
          ]
        },
        "severity_override": {
          "enum": [
            "high",
            "medium",
            "low",
            "note"
          ]
        },
        "comment": {
          "type": "string",
          "maxLength": 4000
        }
      },
      "anyOf": [
        {
          "required": [
            "disposition"
          ]
        },
        {
          "required": [
            "severity_override"
          ]
        },
        {
          "required": [
            "comment"
          ]
        }
      ]
    },
    "findingNode": {
      "type": "object",
      "additionalProperties": false,
      "required": [
        "id",
        "type",
        "category",
        "severity",
        "status",
        "title",
        "detail",
        "fingerprint",
        "model_judgment"
      ],
      "properties": {
        "id": {
          "$ref": "#/$defs/identifier"
        },
        "type": {
          "const": "finding"
        },
        "category": {
          "enum": [
            "bug",
            "risk",
            "quality",
            "scope"
          ]
        },
        "severity": {
          "enum": [
            "high",
            "medium",
            "low",
            "note"
          ]
        },
        "status": {
          "enum": [
            "open",
            "fixed",
            "dismissed"
          ]
        },
        "title": {
          "type": "string",
          "minLength": 1
        },
        "detail": {
          "type": "string"
        },
        "file_path": {
          "type": "string",
          "minLength": 1
        },
        "hunk_id": {
          "$ref": "#/$defs/identifier"
        },
        "start_line": {
          "type": "integer",
          "minimum": 1
        },
        "end_line": {
          "type": "integer",
          "minimum": 1
        },
        "line_side": {
          "enum": [
            "old",
            "new"
          ]
        },
        "highlight_lines": {
          "type": "array",
          "items": {
            "type": "integer",
            "minimum": 1
          },
          "uniqueItems": true
        },
        "hunk": {
          "type": "string",
          "minLength": 1
        },
        "fingerprint": {
          "$ref": "#/$defs/sha256"
        },
        "model_judgment": {
          "$ref": "#/$defs/modelJudgment"
        },
        "human_adjudication": {
          "$ref": "#/$defs/humanAdjudication"
        },
        "extensions": {
          "$ref": "#/$defs/extensions"
        }
      }
    },
    "evidenceNode": {
      "type": "object",
      "additionalProperties": false,
      "required": [
        "id",
        "type",
        "source",
        "status",
        "summary"
      ],
      "properties": {
        "id": {
          "$ref": "#/$defs/identifier"
        },
        "type": {
          "const": "evidence"
        },
        "source": {
          "type": "string",
          "minLength": 1
        },
        "status": {
          "enum": [
            "pass",
            "fail",
            "error",
            "skipped"
          ]
        },
        "summary": {
          "type": "string"
        },
        "command": {
          "type": "string"
        },
        "detail": {
          "type": "string"
        },
        "extensions": {
          "$ref": "#/$defs/extensions"
        }
      }
    },
    "fixNode": {
      "type": "object",
      "additionalProperties": false,
      "required": [
        "id",
        "type",
        "status",
        "priority",
        "title",
        "detail"
      ],
      "properties": {
        "id": {
          "$ref": "#/$defs/identifier"
        },
        "type": {
          "const": "fix"
        },
        "status": {
          "enum": [
            "open",
            "done",
            "deferred",
            "wont_fix"
          ]
        },
        "priority": {
          "enum": [
            "p0",
            "p1",
            "p2",
            "p3"
          ]
        },
        "title": {
          "type": "string",
          "minLength": 1
        },
        "detail": {
          "type": "string"
        },
        "extensions": {
          "$ref": "#/$defs/extensions"
        }
      }
    },
    "artifactNode": {
      "type": "object",
      "additionalProperties": false,
      "required": [
        "id",
        "type",
        "kind",
        "path"
      ],
      "properties": {
        "id": {
          "$ref": "#/$defs/identifier"
        },
        "type": {
          "const": "artifact"
        },
        "kind": {
          "enum": [
            "audit_json",
            "audit_html",
            "audit_feedback_jsonl"
          ]
        },
        "path": {
          "type": "string",
          "minLength": 1
        },
        "media_type": {
          "type": "string"
        },
        "sha256": {
          "type": "string",
          "pattern": "^[0-9a-f]{64}$"
        },
        "extensions": {
          "$ref": "#/$defs/extensions"
        }
      }
    },
    "node": {
      "oneOf": [
        {
          "$ref": "#/$defs/changeNode"
        },
        {
          "$ref": "#/$defs/fileNode"
        },
        {
          "$ref": "#/$defs/findingNode"
        },
        {
          "$ref": "#/$defs/evidenceNode"
        },
        {
          "$ref": "#/$defs/fixNode"
        },
        {
          "$ref": "#/$defs/artifactNode"
        }
      ]
    },
    "edge": {
      "type": "object",
      "additionalProperties": false,
      "required": [
        "id",
        "type",
        "from",
        "to"
      ],
      "properties": {
        "id": {
          "$ref": "#/$defs/identifier"
        },
        "type": {
          "enum": [
            "contains_change",
            "supersedes_run",
            "changes_file",
            "finding_in_file",
            "supported_by_evidence",
            "requires_fix",
            "rendered_as",
            "supports_claim",
            "challenges_claim"
          ]
        },
        "from": {
          "$ref": "#/$defs/identifier"
        },
        "to": {
          "$ref": "#/$defs/identifier"
        },
        "claim_id": {
          "$ref": "#/$defs/identifier"
        },
        "extensions": {
          "$ref": "#/$defs/extensions"
        }
      }
    },
    "summarySnapshot": {
      "type": "object",
      "additionalProperties": false,
      "required": [
        "review_status",
        "verdict",
        "overall_severity",
        "finding_count",
        "open_finding_count",
        "fix_count"
      ],
      "properties": {
        "review_status": {
          "enum": [
            "not_reviewed",
            "complete",
            "partial",
            "failed"
          ]
        },
        "verdict": {
          "enum": [
            "pass_candidate",
            "concerns",
            "needs_human_triage",
            "inconclusive"
          ]
        },
        "overall_severity": {
          "enum": [
            "high",
            "medium",
            "low",
            "note",
            null
          ]
        },
        "finding_count": {
          "type": "integer",
          "minimum": 0
        },
        "open_finding_count": {
          "type": "integer",
          "minimum": 0
        },
        "fix_count": {
          "type": "integer",
          "minimum": 0
        },
        "fix_done_count": {
          "type": "integer",
          "minimum": 0
        },
        "summary_audit_status": {
          "enum": [
            "supported",
            "challenged",
            "partial",
            "unknown",
            "not_audited"
          ]
        },
        "basis": {
          "enum": [
            "model_review",
            "human_adjudication"
          ]
        },
        "model_verdict": {
          "enum": [
            "pass_candidate",
            "concerns",
            "needs_human_triage",
            "inconclusive"
          ]
        },
        "model_overall_severity": {
          "enum": [
            "high",
            "medium",
            "low",
            "note",
            null
          ]
        },
        "notice": {
          "const": "报告已按人工裁定更新；未重新审查代码，模型原判断仍保留。"
        },
        "extensions": {
          "$ref": "#/$defs/extensions"
        }
      }
    },
    "summary": {
      "allOf": [
        {
          "$ref": "#/$defs/summarySnapshot"
        },
        {
          "required": [
            "basis"
          ]
        },
        {
          "if": {
            "properties": {
              "basis": {
                "const": "human_adjudication"
              }
            },
            "required": [
              "basis"
            ]
          },
          "then": {
            "required": [
              "model_verdict",
              "model_overall_severity",
              "notice"
            ]
          }
        }
      ]
    }
  }
}
